Name, Title, Description,Image,
Capt. Helena Vance, Founder & CEO,"A former astronaut and a propulsion physicist, Capt. Vance brings unparalleled expertise and vision to Orion, leading the team towards uncharted territories.",images/team/1.jpg,
Dr. Hiroshi Nakamura, CTO,"A genius in aerospace engineering, Dr. Nakamura's innovations form the backbone of Orion's groundbreaking spacecrafts and aerial vehicles.",images/team/4.jpg,
Leo Rodriguez, Chief of Design,"A former astronaut and a propulsion physicist, Capt. Vance brings unparalleled expertise and vision to Orion, leading the team towards uncharted territories.",images/team/2.jpg,
Ava O'Connell, VP of Operations,"Managing the intricate logistics of aerospace projects is Ava's forte. Her meticulous planning ensures that missions are executed flawlessly.",images/team/3.jpg,
Dr. Imani Okoro, Head of AeroAcademy™,"A space historian and a former NASA educator ensuring that the academy produces the best minds in aerospace.",images/team/4.jpg,
